cochrane_id,title,year,month,day,version,url,cochrane_review_group_code,cochrane_review_topic,abstract,plain_language_summary
CD013201.pub3,Stem cell‐based interventions for the prevention and treatment of intraventricular haemorrhage and encephalopathy of prematurity in preterm infants,2023,February,15,3,https://doi.org/10.1002/14651858.CD013201.pub3,Neonatal,Neonatal care,"Background
Germinal matrix‐intraventricular haemorrhage (GMH‐IVH) and encephalopathy of prematurity (EoP) remain substantial issues in neonatal intensive care units worldwide. Current therapies to prevent or treat these conditions are limited. Stem cell‐based therapies offer a potential therapeutic approach to repair, restore, or regenerate injured brain tissue. These preclinical findings have now culminated in ongoing human neonatal studies. This is an update of the 2019 review, which did not include EoP.

Objectives
To evaluate the benefits and harms of stem cell‐based interventions for prevention or treatment of GM‐IVH and EoP in preterm infants.

Search methods
We used standard, extensive Cochrane search methods. The latest search was April 2022.

Selection criteria
We attempted to include randomised controlled trials, quasi‐randomised controlled trials, and cluster trials comparing 1. stem cell‐based interventions versus control; 2. mesenchymal stromal cells (MSCs) of type or source versus MSCs of other type or source; 3. stem cell‐based interventions other than MSCs of type or source versus stem cell‐based interventions other than MSCs of other type or source; or 4. MSCs versus stem cell‐based interventions other than MSCs. For prevention studies, we included extremely preterm infants (less than 28 weeks' gestation), 24 hours of age or less, without ultrasound diagnosis of GM‐IVH or EoP; for treatment studies, we included preterm infants (less than 37 weeks' gestation), of any postnatal age, with ultrasound diagnosis of GM‐IVH or with EoP.

Data collection and analysis
We used standard Cochrane methods. Our primary outcomes were 1. all‐cause neonatal mortality, 2. major neurodevelopmental disability, 3. GM‐IVH, 4. EoP, and 5. extension of pre‐existing non‐severe GM‐IVH or EoP. We planned to use GRADE to assess certainty of evidence for each outcome.

Main results
We identified no studies that met our inclusion criteria. Three studies are currently registered and ongoing. Phase 1 trials are described in the 'Excluded studies' section.

Authors' conclusions
No evidence is currently available to evaluate the benefits and harms of stem cell‐based interventions for treatment or prevention of GM‐IVH or EoP in preterm infants. We identified three ongoing studies, with a sample size range from 20 to 200. In two studies, autologous cord blood mononuclear cells will be administered to extremely preterm infants via the intravenous route; in one, intracerebroventricular injection of MSCs will be administered to preterm infants up to 34 weeks' gestational age.","Stem cell‐based therapies for brain injury in newborns born preterm
Review question

Do stem cell‐based therapies save the lives or improve the long‐term development of preterm newborns who have or may develop bleeding to the brain (intraventricular haemorrhage) or grey matter damage?

Background

Newborns born too early ('preterm'), especially babies born before 28 weeks of pregnancy, sometimes develop bleeding to the brain. Babies with less severe bleeding may make a full recovery or may have only mild problems. For other babies with more serious bleeding, or with grey matter damage, this may lead to death or to problems later in life. The brain is growing very fast during the second and third trimester of pregnancy. Nerve cells move throughout the brain to destination regions, where they become mature and make connections with each other in order to proceed with the information. In addition, some nerve fibres are surrounded by a specific insulating layer, called myelin, and the process of such insulation – myelinisation – starts around 24 weeks of pregnancy. If the baby is born preterm these processes in the brain may be altered and there is a higher risk for long‐term abnormal neurodevelopment. This condition is called 'encephalopathy of prematurity'. For instance, some of these babies develop intellectual disabilities, behavioural problems, concentration difficulties, socialisation problems, and cerebral palsy. Currently, no approaches are available to prevent or treat bleeding to the brain or grey matter damage.

What did we want to find out?

The aim of this review was to assess whether stem cell‐based therapies could reduce death and improve the long‐term development of newborns born too early. During cell stem‐based therapy, stem cells are given to the baby, for instance, through injection. These stem cells may have come from humans or animals and may have been taken from cord blood, bone marrow, or other parts of the body. These cells then repair the brain cells that have been damaged by bleeding or grey matter damage.

What did we do?

We searched medical databases for clinical trials looking at stem cell‐based therapies for brain injury in newborns born too soon.

Key results

We were unable to include any studies in our review. We did identify nine studies, but we excluded them because of the way they were designed, which meant that their results could not answer our review question.

How current is the evidence?

This review updates and expands our previous review which was published in 2019. The evidence is current to April 2022.
"
CD007593.pub2,Methods for informing people with amyotrophic lateral sclerosis/motor neuron disease of their diagnosis,2023,February,22,2,https://doi.org/10.1002/14651858.CD007593.pub2,Neuromuscular,Neurology,"Background
Amyotrophic lateral sclerosis (ALS), also known as motor neuron disease (MND), causes increasing physical impairment and disability. People with ALS/MND face huge physical challenges, and the diagnosis can be a source of great psychological distress for both people with ALS/MND and their carers. In such a context, how news of the diagnosis is broken is important. At present, there are no systematic reviews of methods for informing people with ALS/MND of their diagnosis.

Objectives
To examine the effects and effectiveness of different methods for informing people of a diagnosis of amyotrophic lateral sclerosis/motor neuron disease (ALS/MND), including effects on the person's knowledge and understanding of their disease, its treatment, and care; and on coping and adjustment to the effects of ALS/MND, its treatment, and care.

Search methods
We searched the Neuromuscular Specialised Register, CENTRAL, MEDLINE, Embase, PsycINFO, and two trials registers (February 2022). We contacted individuals or organisations to locate studies. We contacted study authors to obtain additional unpublished data.

Selection criteria
We planned to include randomised controlled trials (RCTs) and quasi‐RCTs of techniques for informing people with ALS/MND of their diagnosis. We planned to include adults (aged 17 years or over) with ALS/MND, according to the El Escorial criteria.

Data collection and analysis
Three review authors independently reviewed the results of the search to identify RCTs, and three review authors identified non‐randomised studies to include in the discussion section. We planned that two review authors would independently extract data, and three would assess the risk of bias in any included trials.

Main results
We did not identify any RCTs that met our inclusion criteria.

Authors' conclusions
There are no RCTs that evaluate different communication strategies for breaking the bad news for people diagnosed with ALS/MND.

Focused research studies are needed to assess the effectiveness and efficacy of different communication methods.
","Methods for informing people with amyotrophic lateral sclerosis/motor neuron disease of their diagnosis
Review question

We planned to assess the evidence about communicating the diagnosis of amyotrophic lateral sclerosis (ALS) or motor neuron disease (MND).

Background

ALS, which is also known as MND, is an illness affecting the nerves that control movement. It causes increasing disability, including limb weakness, difficulty with breathing, and speech and swallowing problems. Most importantly, people with ALS/MND have to cope with the fact that ALS/MND usually leads to death within three to five years of onset. At diagnosis, people with ALS/MND, relatives, and carers can experience enormous distress, therefore, it is important to understand how to tell them the diagnosis. We carried out a wide search for randomised controlled trials (RCTs) of methods of communicating the diagnosis of ALS/MND.

Results

We found no RCTs of methods for giving a diagnosis of ALS/MND.

We searched to February 2022.
"
CD008106.pub4,Surgical versus non‐surgical interventions for treating patellar dislocation,2023,January,24,4,https://doi.org/10.1002/14651858.CD008106.pub4,"Bone, Joint and Muscle Trauma",Orthopaedics & trauma,"Background
Patellar (knee cap) dislocation occurs when the patella disengages completely from the trochlear (femoral) groove. It affects up to 42/100,000 people, and is most prevalent in those aged 20 to 30 years old. It is uncertain whether surgical or non‐surgical treatment is the best approach. This is important as recurrent dislocation occurs in up to 40% of people who experience a first time (primary) dislocation. This can reduce quality of life and as a result people have to modify their lifestyle. This review is needed to determine whether surgical or non‐surgical treatment should be offered to people after patellar dislocation.

Objectives
To assess the effects (benefits and harms) of surgical versus non‐surgical interventions for treating people with primary or recurrent patellar dislocation.

Search methods
We searched the Cochrane Bone, Joint and Muscle Trauma Group's Specialised Register, the Cochrane Central Register of Controlled Trials (CENTRAL), MEDLINE, Embase, AMED, CINAHL, Physiotherapy Evidence Database and trial registries in December 2021. We contacted corresponding authors to identify additional studies.

Selection criteria
We included randomised and quasi‐randomised controlled clinical trials evaluating surgical versus non‐surgical interventions for treating primary or recurrent lateral patellar dislocation in adults or children.

Data collection and analysis
We used standard Cochrane methods. Our primary outcomes were recurrent patellar dislocation, and patient‐rated knee and physical function scores. Our secondary outcomes were health‐related quality of life, return to former activities, knee pain during activity or at rest, adverse events, patient‐reported satisfaction, patient‐reported knee instability symptoms and subsequent requirement for knee surgery. We used GRADE to assess the certainty of evidence for each outcome.

Main results
We included 10 studies (eight randomised controlled trials (RCTs) and two quasi‐RCTs) of 519 participants with patellar dislocation. The mean ages in the individual studies ranged from 13.0 to 27.2 years. Four studies included children, mainly adolescents, as well as adults; two only recruited children. Study follow‐up ranged from one to 14 years.

We are unsure of the evidence for all outcomes in this review because we judged the certainty of the evidence to be very low. We downgraded each outcome by three levels. Reasons included imprecision (when fewer than 100 events were reported or the confidence interval (CI) indicated appreciable benefits as well as harms), risk of bias (when studies were at high risk of performance, detection and attrition bias), and inconsistency (in the event that pooled analysis included high levels of statistical heterogeneity).

We are uncertain whether surgery lowers the risk of recurrent dislocation following primary patellar dislocation compared with non‐surgical management at two to nine year follow‐up. Based on an illustrative risk of recurrent dislocation in 348 people per 1000 in the non‐surgical group, we found that 157 fewer people per 1000 (95% CI 209 fewer to 87 fewer) had recurrent dislocation between two and nine years after surgery (8 studies, 438 participants).

We are uncertain whether surgery improves patient‐rated knee and function scores. Studies measured this outcome using different scales (the Tegner activity scale, Knee Injury and Osteoarthritis Outcome Score, Lysholm, Kujala Patellofemoral Disorders score and Hughston visual analogue scale). The most frequently reported score was the Kujala Patellofemoral Disorders score. This indicated people in the surgical group had a mean score of 5.73 points higher at two to nine year follow‐up (95% CI 2.91 lower to 14.37 higher; 7 studies, 401 participants). On this 100‐point scale, higher scores indicate better function, and a change score of 10 points is considered to be clinically meaningful; therefore, this CI includes a possible meaningful improvement.

We are uncertain whether surgery increases the risk of adverse events. Based on an assumed risk of overall incidence of complications during the first two years in 277 people out of 1000 in the non‐surgical group, 335 more people per 1000 (95% CI 75 fewer to 723 more) had an adverse event in the surgery group (2 studies, 144 participants).

Three studies (176 participants) assessed participant satisfaction at two to nine year follow‐up, reporting little difference between groups. Based on an assumed risk of 763 per 1000 non‐surgical participants reporting excellent or good outcomes, seven more participants per 1000 (95% CI 199 fewer to 237 more) reported excellent or good satisfaction.

Four studies (256 participants) assessed recurrent patellar subluxation at two to nine year follow‐up. Based on an assumed risk of patellar subluxation in 292 out of 1000 in the non‐surgical group, 73 fewer people per 1000 (95% CI 146 fewer to 35 more) had patellar subluxation as a result of surgery.

Slightly more people had subsequent surgery in the non‐surgical group. Pooled two to nine year follow‐up data from three trials (195 participants) indicated that, based on an assumed risk of subsequent surgery in 215 people per 1000 in the non‐surgical group, 118 fewer people per 1000 (95% CI 200 fewer to 372 more) had subsequent surgery after primary surgery.

Authors' conclusions
We are uncertain whether surgery improves outcome compared to non‐surgical management as the certainty of the evidence was very low. No sufficiently powered trial has examined people with recurrent patellar dislocation. Adequately powered, multicentre, randomised trials are needed. To inform the design and conduct of these trials, expert consensus should be achieved on the minimal description of both surgical and non‐surgical interventions, and the pathological variations that may be relevant to both choice of these interventions.","Surgery or non‐surgical treatments: which works better to treat people who have a dislocated knee cap?
Key messages

We did not find enough good‐quality evidence to show whether surgery or non‐surgical treatment works better to treat people who have a dislocated knee cap.

Good‐quality research is required that compare these treatments.

What is a dislocated knee cap?

The knee cap is a lens‐shaped bone at the front of the knee. A dislocation occurs when the knee cap completely moves out of the groove in the thigh‐bone at the knee. It typically occurs in young, physically active people when they twist their bent knee whilst their foot is fixed to the ground. The cause of a dislocation may be linked to an abnormal shape of the knee bones, weakness of the muscles around the hip or knees, or tightness of soft tissues on the outside of the knee.

After a knee cap dislocation, some people recover completely. But some people may have repeated dislocations, or a feeling of instability in their knee cap, or both. They may also have persistent pain or limited function.

How is a dislocated knee cap treated?

When the knee cap dislocates, the soft tissues around the knee are injured. People need to have treatment to help restore the knee back to full health. This may include treatments such as holding the knee in place (by wearing a kind of brace or bandage), exercises, manual therapy (such as physiotherapy) and taping the area around the knee. However, some doctors suggest that people may have a better outcome if surgery is performed. Surgery may be used to: repair or reconstruct the injured ligaments and muscles that hold the knee cap in the groove, reshape the groove, or change where the knee cap attaches to the shin‐bone to stop it from dislocating again.

What did we want to find out?

We wanted to find out whether surgery or non‐surgical treatment was better at preventing another knee cap dislocation and restoring knee function. We also looked at any unwanted effects of treatment, how satisfied people were with their treatment, symptoms of instability and the need for surgery after the initial treatment.

What did we do?

We searched the medical literature until December 2021 for studies that compared surgical with non‐surgical treatment for adults or children who had a patellar dislocation. We summarised and compared the results of the studies and rated our confidence in the evidence, based on factors such as study methods and sizes.

What did we find?

We found 10 relevant studies (519 adults and children). Studies randomly allocated people to receive surgery or a non‐surgical treatment. In nine studies, people were treated for a first‐time dislocation, one study treated people after repeated knee cap dislocations. People ranged from 13 to 27 years of age, with six studies including children. People in the studies were monitored from one to nine years after their injury.

Main results

We were very uncertain about whether surgery compared to non‐surgical treatment:

‐ reduced the number of repeat dislocations;

‐ affected how well the knee cap worked;

‐ increased or reduced the risk of side effects;

‐ made a difference to how satisfied people were with treatment;

‐ increased or reduced instability in the knee cap; or

‐ increased or reduced the need for additional surgery.

What are the limitations of the evidence?

These studies were small. Some had weaknesses in their design and conduct. The quality of the evidence is very low. We were very uncertain about these findings.

How up to date is this evidence?

This review updates our previous review. The evidence is up to date to December 2021."
