cochrane_id,title,year,month,day,version,url,cochrane_review_group_code,cochrane_review_topic,abstract,plain_language_summary
CD013740.pub2,Mindfulness‐based psychological interventions for improving mental well‐being in medical students and junior doctors,2021,December,10,2,https://doi.org/10.1002/14651858.CD013740.pub2,Common Mental Disorders,Health & safety at work,"Background
Mindfulness interventions are increasingly popular as an approach to improve mental well‐being. To date, no Cochrane Review examines the effectiveness of mindfulness in medical students and junior doctors. Thus, questions remain regarding the efficacy of mindfulness interventions as a preventative mechanism in this population, which is at high risk for poor mental health. 

Objectives
To assess the effects of psychological interventions with a primary focus on mindfulness on the mental well‐being and academic performance of medical students and junior doctors.

Search methods
We searched the Cochrane Central Register of Controlled Trials (CENTRAL), MEDLINE, Embase and five other databases (to October 2021) and conducted grey literature searches. 

Selection criteria
We included randomised controlled trials of mindfulness that involved medical students of any year level and junior doctors in postgraduate years one, two or three. We included any psychological intervention with a primary focus on teaching the fundamentals of mindfulness as a preventative intervention. Our primary outcomes were anxiety and depression, and our secondary outcomes included stress, burnout, academic performance, suicidal ideation and quality of life. 

Data collection and analysis
We used standard methods as recommended by Cochrane, including Cochrane's risk of bias 2 tool (RoB2). 

Main results
We included 10 studies involving 731 participants in quantitative analysis. 

Compared with waiting‐list control or no intervention, mindfulness interventions did not result in a substantial difference immediately post‐intervention for anxiety (standardised mean difference (SMD) 0.09, 95% CI ‐0.33 to 0.52; P = 0.67, I2 = 57%; 4 studies, 255 participants; very low‐certainty evidence). Converting the SMD back to the Depression, Anxiety and Stress Scale 21‐item self‐report questionnaire (DASS‐21) showed an estimated effect size which is unlikely to be clinically important. Similarly, there was no substantial difference immediately post‐intervention for depression (SMD 0.06, 95% CI ‐0.19 to 0.31; P = 0.62, I2 = 0%; 4 studies, 250 participants; low‐certainty evidence). Converting the SMD back to DASS‐21 showed an estimated effect size which is unlikely to be clinically important. No studies reported longer‐term assessment of the impact of mindfulness interventions on these outcomes. 

For the secondary outcomes, the meta‐analysis showed a small, substantial difference immediately post‐intervention for stress, favouring the mindfulness intervention (SMD ‐0.36, 95% CI ‐0.60 to ‐0.13; P < 0.05, I2 = 33%; 8 studies, 474 participants; low‐certainty evidence); however, this difference is unlikely to be clinically important. The meta‐analysis found no substantial difference immediately post‐intervention for burnout (SMD ‐0.42, 95% CI ‐0.84 to 0.00; P = 0.05, I² = 0%; 3 studies, 91 participants; very low‐certainty evidence). The meta‐analysis found a small, substantial difference immediately post‐intervention for academic performance (SMD ‐0.60, 95% CI ‐1.05 to ‐0.14; P < 0.05, I² = 0%; 2 studies, 79 participants; very low‐certainty evidence); however, this difference is unlikely to be clinically important. Lastly, there was no substantial difference immediately post‐intervention for quality of life (mean difference (MD) 0.02, 95% CI ‐0.28 to 0.32; 1 study, 167 participants; low‐certainty evidence). There were no data available for three pre‐specified outcomes of this review: deliberate self‐harm, suicidal ideation and suicidal behaviour.

We assessed the certainty of evidence to range from low to very low across all outcomes. Across most outcomes, we most frequently judged the risk of bias as having 'some concerns'. There were no studies with a low risk of bias across all domains. 

Authors' conclusions
The effectiveness of mindfulness in our target population remains unconfirmed. There have been relatively few studies of mindfulness interventions for junior doctors and medical students. The available studies are small, and we have some concerns about their risk of bias. Thus, there is not much evidence on which to draw conclusions on effects of mindfulness interventions in this population. There was no evidence to determine the effects of mindfulness in the long term. ","Mindfulness for improving mental well‐being in medical students and junior doctors
Why is this review important?

The medical profession is recognised for its challenging and demanding nature. Medical students and junior doctors have been identified as having increased personal and professional stressors during their years of training. As a result, they face increased strain on their mental well‐being. It is important that this group is supported in their mental well‐being to ensure an overall balance in health, as well as to aid their responsibilities of patient care and patient safety. Furthermore, medical students and junior doctors are often time‐poor. Therefore, it is important to establish whether mindfulness is an effective intervention which justifies its time commitment. There are no previous Cochrane Reviews examining mindfulness in our target population. 

Who will be interested in this review?

Medical students and junior doctors; other medical professionals at different levels of training and expertise; and institutions such as universities and hospitals involved in the education and training of medical students. 

What question does this review aim to answer?

What effects do mindfulness‐based psychological interventions have on the mental well‐being of medical students and junior doctors?

Which studies were included in this review?

We searched databases to find all studies of mindfulness in medical students and junior doctors published up to October 2021. In order to be included in this review, studies had to be randomised controlled trials (a type of study in which participants are assigned to groups using a random method). Studies needed to include medical students from any year level or junior doctors in postgraduate years one, two or three. We did not exclude any studies based on participants' age, nationality or pre‐existing health conditions. We included 10 studies with a total of 731 participants in the analysis. 

What does the evidence from the review tell us?

Overall, we did not identify any evidence of an effect of mindfulness‐based interventions on anxiety or depression symptoms. However, mindfulness‐based interventions appeared to have a small positive effect on stress and a borderline positive effect on burnout. We were unable to report if mindfulness‐based interventions had any effect on deliberate self‐harm, suicidal ideation or suicidal behaviour as no studies examined these outcomes. Lastly, as many studies lacked longer‐term follow‐up of participants, it is not possible to comment on the long‐term effects of mindfulness in medical students and junior doctors. 

We rated the overall certainty of evidence as 'low' or 'very low'. 

What should happen next?

While there were no strong positive findings from the review, some results regarding mindfulness and stress outcomes suggest that there needs to be further research into mindfulness. Any future research should be rigorously designed, and ideally, include assessments of the longer‐term impact of mindfulness.  "
CD013536.pub2,Parenting interventions for people with schizophrenia or related serious mental illness,2021,October,19,2,https://doi.org/10.1002/14651858.CD013536.pub2,Schizophrenia,Health professional education,"Background
Around a third of people with schizophrenia or related serious mental illness will be a parent. Both the parents and the children in this population are at increased risk of adverse outcomes due to parental mental illness. Parenting interventions are known to improve parenting skills and decrease child disruptive behaviour. This systematic review aimed to synthesise the evidence base for parenting interventions designed specifically for parents who have schizophrenia or related serious mental illness.

Objectives
To assess the effects of parenting interventions for people with schizophrenia or related serious mental illness.

Search methods
On 10 February 2021 we searched the Cochrane Schizophrenia Group's Study‐Based Register of Trials, which is based on the following: Cochrane Central Register of Controlled Trials (CENTRAL), Cumulative Index to Nursing and Allied Health Literature (CINAHL), ClinicalTrials.Gov, Embase, International Standard Randomised Controlled Trial Number (ISRCTN), MEDLINE, PsycINFO, PubMed, and the World Health Organization International Clinical Trials Registry Platform.

Selection criteria
Eligible studies were randomised controlled trials (RCTs) that compared parenting interventions with a control condition for people with schizophrenia or related serious mental illness with a child between the ages of 0 and 18 years.

Data collection and analysis
We independently inspected citations, selected studies, extracted data and appraised study quality. We assessed risk of bias for included studies.

Main results
We only included one trial (n = 50), and it was not possible to extract any data because the authors did not provide any means and standard deviations for our outcomes of interest; they only reported whether outcomes were significant or not at the 0.05 level. Three domains of the trial were rated as having a high risk of bias.

Authors' conclusions
The only included trial provided inconclusive evidence. There is insufficient evidence to make recommendations to people with schizophrenia (or related serious mental illness) or clinicians, or for policy changes. Although there is no RCT evidence, parenting interventions for people with schizophrenia or related serious mental illness have been developed. Future research should test these in RCTs in order to improve the evidence base for this population.","Parenting programmes for parents with schizophrenia or related serious mental illness
Review question

How effective are parenting programmes for people with schizophrenia or related serious mental illness?

Background

Around one third of people with schizophrenia are a parent. Parenting programmes aim to provide support and training for parents to help manage their child's behaviour. Targeted parenting programmes for this group could have a positive effect for both the parents and their children. This review aimed to gather the current evidence for parenting programmes for people with schizophrenia or related mental illness to understand whether such support is effective at improving parenting skills or parent‐child interaction.

Searching

We ran an electronic search in March 2020 and February 2021 for randomised controlled trials of parenting programmes aimed at people with schizophrenia or related serious mental illness. We found 36 studies and checked these to see if they were relevant to our research.

Available evidence

One trial met the review requirements but did not provide usable data. Therefore, there is not enough robust evidence to know anything about the effectiveness of parenting programmes for people with schizophrenia or related mental illness.

Conclusions

There is not enough evidence to make recommendations about parenting programmes for people with schizophrenia or related serious mental illness. Future research should conduct rigorous studies to test the effectiveness of parenting programmes that have already been designed."
CD013649.pub2,Drugs to reduce bleeding and transfusion in major open vascular or endovascular surgery: a systematic review and network meta‐analysis,2023,February,17,2,https://doi.org/10.1002/14651858.CD013649.pub2,Vascular,Heart & circulation,"Background
Vascular surgery may be followed by internal bleeding due to inadequate surgical haemostasis, abnormal clotting, or surgical complications. Bleeding ranges from minor, with no transfusion requirement, to massive, requiring multiple blood product transfusions. There are a number of drugs, given systemically or applied locally, which may reduce the need for blood transfusion.

Objectives
To assess the effectiveness and safety of anti‐fibrinolytic and haemostatic drugs and agents in reducing bleeding and the need for blood transfusion in people undergoing major vascular surgery or vascular procedures with a risk of moderate or severe (> 500 mL) blood loss.

Search methods
We searched: Cochrane Central Register of Controlled Trials; MEDLINE; Embase; CINAHL, and Transfusion Evidence Library. We also searched the WHO ICTRP and ClinicalTrials.gov trial registries for ongoing and unpublished trials. Searches used a combination of MeSH and free text terms from database inception to 31 March 2022, without restriction on language or publication status.

Selection criteria
We included randomised controlled trials (RCTs) in adults of drug treatments to reduce bleeding due to major vascular surgery or vascular procedures with a risk of moderate or severe blood loss, which used placebo, usual care or another drug regimen as control.

Data collection and analysis
We used standard Cochrane methods. Our primary outcomes were units of red cells transfused and all‐cause mortality. Our secondary outcomes included risk of receiving an allogeneic blood product, risk of reoperation or repeat procedure due to bleeding, risk of a thromboembolic event, risk of a serious adverse event and length of hospital stay. We used GRADE to assess certainty of evidence.

Main results
We included 22 RCTs with 3393 participants analysed, of which one RCT with 69 participants was reported only in abstract form, with no usable data. Seven RCTs evaluated systemic drug treatments (three aprotinin, two desmopressin, two tranexamic acid) and 15 RCTs evaluated topical drug treatments (drug‐containing bioabsorbable dressings or glues), including fibrin, thrombin, collagen, gelatin, synthetic sealants and one investigational new agent. Most trials were conducted in high‐income countries and the majority of the trials only included participants undergoing elective surgery. We also identified two ongoing RCTs.

We were unable to perform the planned network meta‐analysis due to the sparse reporting of outcomes relevant to this review.

Systemic drug treatments

We identified seven trials of three systemic drugs: aprotinin, desmopressin and tranexamic acid, all with placebo controls. The trials of aprotinin and desmopressin were small with very low‐certainty evidence for all of our outcomes. Tranexamic acid versus placebo was the systemic drug comparison with the largest number of participants (2 trials; 1460 participants), both at low risk of bias. The largest of these included a total of 9535 individuals undergoing a number of different higher risk surgeries and reported limited information on the vascular subgroup (1399 participants).

Neither trial reported the number of units of red cells transfused per participant up to 30 days. Three outcomes were associated with very low‐certainty evidence due to the very wide confidence intervals (CIs) resulting from small study sizes and low number of events. These were: all‐cause mortality up to 30 days; number of participants requiring an allogeneic blood transfusion up to 30 days; and risk of requiring a repeat procedure or operation due to bleeding.

Tranexamic acid may have no effect on the risk of thromboembolic events up to 30 days (risk ratio (RR) 1.10, 95% CI 0.88 to 1.36; 1 trial, 1360 participants; low‐certainty evidence due to imprecision).

There is one large ongoing trial (8320 participants) comparing tranexamic acid versus placebo in people undergoing non‐cardiac surgery who are at high risk of requiring a red cell transfusion. This aims to complete recruitment in April 2023. This trial has primary outcomes of proportion of participants transfused with red blood cells and incidence of venous thromboembolism (DVT or PE).

Topical drug treatments

Most trials of topical drug treatments were at high risk of bias due to their open‐label design (compared with usual care, or liquids were compared with sponges). All of the trials were small, most were very small, and few reported clinically relevant outcomes in the postoperative period. Fibrin sealant versus usual care was the topical drug comparison with the largest number of participants (5 trials, 784 participants).

The five trials that compared fibrin sealant with usual care were all at high risk of bias, due to the open‐label trial design with no measures put in place to minimise reporting bias. All of the trials were funded by pharmaceutical companies.

None of the five trials reported the number of red cells transfused per participant up to 30 days or the number of participants requiring an allogeneic blood transfusion up to 30 days.

The other three outcomes were associated with very low‐certainty evidence with wide confidence intervals due to small sample sizes and the low number of events, these were: all‐cause mortality up to 30 days; risk of requiring a repeat procedure due to bleeding; and risk of thromboembolic disease up to 30 days.

We identified one large trial (500 participants) comparing fibrin sealant versus usual care in participants undergoing abdominal aortic aneurysm repair, which has not yet started recruitment. This trial lists death due to arterial disease and reintervention rates as primary outcomes.

Authors' conclusions
Because of a lack of data, we are uncertain whether any systemic or topical treatments used to reduce bleeding due to major vascular surgery have an effect on: all‐cause mortality up to 30 days; risk of requiring a repeat procedure or operation due to bleeding; number of red cells transfused per participant up to 30 days or the number of participants requiring an allogeneic blood transfusion up to 30 days.

There may be no effect of tranexamic acid on the risk of thromboembolic events up to 30 days, this is important as there has been concern that this risk may be increased.

Trials with sample size targets of thousands of participants and clinically relevant outcomes are needed, and we look forward to seeing the results of the ongoing trials in the future.","Are there any drugs which help reduce bleeding after surgery on blood vessels?
• Key messages

We do not yet know what the best drugs are to reduce bleeding and blood transfusions during vascular surgery.

• What is vascular surgery?

Vascular surgery is when a surgeon operates on blood vessels, to repair leaks and areas of weakness, or to clear blockages. This review focused on the types of vascular surgery that are more likely to lead to severe bleeding.

• Why is it important to reduce blood transfusions during vascular surgery?

If people bleed a lot during or after this type of surgery they may need blood transfusions to replace the blood they have lost. It is better to avoid receiving a blood transfusion, if possible, because blood transfusions can cause harm. This is especially important when health services have limited blood supplies.

• What did we want to find out?

We wanted to find out which drug treatments help reduce bleeding and the need for blood transfusion. We also wanted to find out if these treatments increase the risk of side effects, such as blood clots.

• What did we do?

We searched electronic libraries for reports of the most reliable studies (called randomised controlled trials) of drugs to prevent bleeding after surgery on blood vessels.

• What did we find?

We found seven trials of drugs injected before surgery to try to reduce the amount of bleeding. We found 15 trials of dressings or glues with drugs in them. These are used to stop bleeding during surgery and are left inside after the operation. We did not find enough information to be sure which drugs are best for reducing bleeding and transfusions during vascular surgery. Often, the people having surgery were not followed up for very long once they left the operating theatre, so we could not find out whether they needed a blood transfusion afterwards.

One trial, of 9535 people having surgery, tested a drug called tranexamic acid injected before surgery. This included 1399 people who had surgery on their blood vessels, but it did not report much information for this group on its own. The one outcome it did report on, specifically for vascular surgery, was whether there was an increased risk of developing a blood clot if tranexamic acid is given. We found that there may be no difference in the risk of developing a blood clot between tranexamic acid and a placebo.

• What are the limitations of the evidence?

Most of the trials we found were small, with fewer than 100 people included. This is not enough to be sure if any of these treatments might help people. We need to have trials with many hundreds or even thousands of people included to find out if these drugs helped them recover from surgery.

Most of the trials we found did not collect information about blood transfusions after surgery. We think this might be for a few different reasons. Surgeons may transfer the care of patients they have operated on to the care of other healthcare professionals if they require prolonged postoperative care, e.g. physicians. It is more complicated to do a study if they need to work with other healthcare professionals to find out what happened afterwards.

Also, most of the trials were run by the companies that make the treatments. It is cheaper and easier for them to only look at what happens during surgery, especially if people will accept their product without any information about what happens after surgery.

• How up to date is this evidence?

We found all the published trials on this topic up to 31 March 2022. We also found all the trials which have started or are going to be starting soon. The good news is that there is one very large trial on drugs to prevent bleeding in surgery that is already in progress. It is testing tranexamic acid injected before surgery. It plans to recruit 8320 people undergoing a range of surgeries, including surgery on blood vessels, and will report the number of people needing blood transfusions. This will be an important result when the trial is completed, and we hope it will inspire other surgeons to do trials of this sort in future."
