cochrane_id,title,year,month,day,version,url,cochrane_review_group_code,cochrane_review_topic,abstract,plain_language_summary
CD002204.pub5,Antifungal therapies for allergic bronchopulmonary aspergillosis in people with cystic fibrosis,2022,September,2,5,https://doi.org/10.1002/14651858.CD002204.pub5,Cystic Fibrosis and Genetic Disorders,Allergy & intolerance,"Background
Allergic bronchopulmonary aspergillosis (ABPA) is an allergic reaction to colonisation of the lungs with the fungus Aspergillus fumigatus, and affects around 10% of people with cystic fibrosis. ABPA is associated with an accelerated decline in lung function. High doses of corticosteroids are the main treatment for ABPA; although the long‐term benefits are not clear, and their many side effects are well‐documented. A group of compounds, the azoles, have activity against A fumigatus, and have been proposed as an alternative treatment for ABPA. Of this group, itraconazole is the most active. A separate antifungal compound, amphotericin B, has been used in aerosolised form to treat invasive infection with A fumigatus, and may have potential for the treatment of ABPA. Antifungal therapy for ABPA in cystic fibrosis needs to be evaluated. This is an update of a previously published review.

Objectives
The review aimed to test the hypotheses that antifungal interventions for the treatment of ABPA in cystic fibrosis:
1. improve clinical status compared to placebo or standard therapy (no placebo); and
2. do not have unacceptable adverse effects.

If benefit was demonstrated, we planned to assess the optimal type, duration, and dose of antifungal therapy.

Search methods
We searched the Cochrane Cystic Fibrosis and Genetic Disorders Group Trials Register, which comprises references identified from comprehensive electronic database searches, handsearches of relevant journals, and abstract books of conference proceedings. Date of the most recent search of the Group's Trials Register was 28 September 2021.

We searched ongoing trials registries, most recently on 11 March 2022.

Earlier, we also approached pharmaceutical companies regarding possible unpublished trials.

Selection criteria
Published or unpublished randomised controlled trials, in which antifungal treatments were compared to either placebo or no treatment, or where different doses of the same treatment were used in the treatment of ABPA in people with cystic fibrosis.

Data collection and analysis
The searches identified six trials; none of which met the inclusion criteria for the review.

Main results
We included no completed randomised controlled trials. There is currently one ongoing trial, which we may find eligible for a future update.

Authors' conclusions
At present, there are no randomised controlled trials that evaluate the use of antifungal therapies for the treatment of ABPA in people with cystic fibrosis, although one trial is currently ongoing.

Trials with clear outcome measures are needed to properly evaluate the use of corticosteroids in people with ABPA and cystic fibrosis.","Treatments to fight fungal infections that cause allergic bronchopulmonary aspergillosis in people with cystic fibrosis
Review question

We planned to review the evidence about the effect of treatments to fight fungal infections that cause allergic bronchopulmonary aspergillosis (ABPA) in people with cystic fibrosis.

Background

ABPA is an allergic lung reaction to a type of fungus (usually Aspergillus fumigatus) in some people with cystic fibrosis. It causes a cough and wheezing, and sometimes fever. If left untreated, ABPA can lead to long‐term lung damage. It is usually treated with a high dose of corticosteroids (also known as steroids). However, it has not been proven that corticosteroids can prevent lung function from deteriorating in the long term. Also, long‐term use of corticosteroids is linked to some serious side effects. Treating the fungus that causes ABPA may be an alternative to using high doses of corticosteroids to combat the allergic reaction. This is an update of a previously published review.

Search date

The evidence is current to 28 September 2021.

Study characteristics

We did not find any trials that we could include in the review.

Key results

There is currently no evidence to recommend the use of antifungal treatment in people with cystic fibrosis and ABPA.

We need trials to assess the effects of corticosteroids in this population in the long and the short term."
CD012969.pub3,Treatment of dental and orthodontic complications in thalassaemia,2023,February,2,3,https://doi.org/10.1002/14651858.CD012969.pub3,Cystic Fibrosis and Genetic Disorders,Blood disorders,"Background
Thalassaemia is a quantitative abnormality of haemoglobin caused by mutations in genes controlling production of alpha or beta globins. Abnormally unpaired globin chains cause membrane damage and cell death within organ systems and destruction of erythroid precursors in the bone marrow, leading to haemolytic anaemia. The life‐long management of the general health effects of thalassaemia is highly challenging, and failure to deal with dental and orthodontic complications exacerbates the public health, financial and personal burden of the condition. There is a lack of evidence‐based guidelines to help care seekers and providers manage such dental and orthodontic complications. This review aimed to evaluate the available evidence on methods for treating dental and orthodontic complications in people with thalassaemia to inform future recommendations. This is an update of a Cochrane Review first published in 2019.

Objectives
To assess different methods for treating dental and orthodontic complications in people with thalassaemia.

Search methods
We searched the Cochrane Cystic Fibrosis and Genetic Disorders Group's Haemoglobinopathies Trials Register in September 2022, and we searched nine online databases and trials registries in January 2022. We searched the reference lists of relevant articles and reviews and contacted haematologists, experts in fields of dentistry, organisations, pharmaceutical companies and researchers working in this field.

Selection criteria
We searched for published or unpublished randomised controlled trials (RCTs) that evaluated treatment of dental and orthodontic complications in individuals diagnosed with thalassaemia, irrespective of phenotype, severity, age, sex and ethnic origin.

Data collection and analysis
Two review authors independently screened the 37,242 titles retrieved by the search. After deduplication, we identified two potentially relevant RCTs. On assessing their eligibility against our inclusion and exclusion criteria, we excluded one and included the other.

Main results
We included one parallel‐design RCT conducted in Saudi Arabia and involving 29 participants (19 males, 10 females) with thalassaemia. It aimed to assess the effectiveness of photodynamic therapy as an adjuvant to conventional full‐mouth ultrasonic scaling for the treatment of gingivitis. The average age of participants was around 23 years.

There is very low‐certainty evidence from this trial that full‐mouth ultrasonic scaling plus photodynamic therapy compared to full‐mouth ultrasonic scaling alone may improve gingival index score and bleeding on probing after 12 weeks in people with thalassaemia.

We found no studies that assessed other interventions for the various dental or orthodontic complications of thalassaemia.

Authors' conclusions
Although the included study showed greater reduction in gingivitis in the group treated with full‐mouth ultrasonic scaling plus photodynamic therapy, the evidence is of very low certainty. The study had unclear risk of bias, a short follow‐up period and no data on safety or adverse effects. We cannot make definitive recommendations for clinical practice based on the limited evidence of a single trial. Future studies will very likely affect the conclusions of this review.

This review highlights the need for high‐quality RCTs that investigate the effectiveness of various treatment modalities for dental and orthodontic complications in people with thalassaemia. It is crucial that future trials assess adverse effects of interventions.","Treatment of dental and orthodontic problems in thalassaemia
What is thalassaemia?

Red blood cells make a pigment known as haemoglobin which carries oxygen around the body. In people with thalassaemia, the haemoglobin is not normal, due to defects (mutations) in two specific types of genes. This leads to the condition being classified as either alpha or beta thalassaemia. About 5% of the world population carry the mutation that causes the alpha globin gene to function only partially or not at all; the carrier rate for the beta globin gene is about 1.5%. Both forms of thalassaemia are mainly found in the belt of countries stretching from Sub‐Saharan Africa, through the Mediterranean region and the Middle East, to South and South‐East Asia. These disorders are increasingly found in many other parts of the world due to people moving from country to country.

How does thalassaemia cause dental and orthodontic problems?

When people inherit two copies of the mutated gene, the defective haemoglobin in the red blood cells does not release oxygen normally into the body. Defective cells build up in the body's organs and bone marrow cells, causing tissue damage and cell death, which leads to a decrease in red blood cells (anaemia). The lack of oxygen due to anaemia can stop organs from working normally, and people often need blood transfusions to correct the decrease in red blood cells. The body tries to compensate for the anaemia naturally by making more red blood cells, which causes expansion of the bone marrow spaces. In the skull, cheekbones and jawbones, this expanding bone marrow causes abnormal bony swellings, which can result in jaw deformity and teeth not being in their correct position (known as malocclusion). Severe changes to the face and jaw lead to difficulties with speech, eating and appearance. These visible features can be distressing for people with thalassaemia and have a negative impact on their quality of life.

To survive, people with thalassaemia have to focus on dealing with the serious impact of anaemia on their general health and on managing complications related to the long‐term treatment of the condition. Consequently, they may neglect dental problems like tooth decay, gum disease and infections, and ordinary dental problems can become more severe and require advanced treatment. Before dental practitioners start any kind of dental treatment in people with thalassaemia, they need to consider both the underlying condition and the effects of the resulting anaemia or its treatment. Dental treatment may be particularly risky in people with thalassaemia who have had their spleen removed, as this can make them more prone to infections. There are no guidelines describing the best treatment plan, due to a lack of information in the scientific literature. 

What did we want to find out?

We wanted to find out if any intervention was better than another to: 

1. improve how teeth are aligned;

2. reduce the severity of any other dental complications;

3. reduce unwanted effects of treatment;

4. reduce pain;

5. reduce infections after dental treatment using preventive antibiotics;

6. improve quality of life; or

7. reduce the effects on professional and academic functions (e.g. loss or change of job, number of days off work or school).

What did we do?

We searched for studies that evaluated any treatment for dental or orthodontic problems in people with thalassaemia. We summarised the results and rated our confidence in the evidence, based on factors such as study methods and sizes. 

What did we find?

We found only one study suitable for inclusion in our review. This trial was conducted in a clinical setting in Saudi Arabia and enroled 29 people with thalassaemia. One group of participants received treatment with a light stimulation device in the infected areas of the gums in addition to professional full‐mouth cleaning, and the other group received professional full‐mouth cleaning only.

Main results

Full‐mouth cleaning plus light stimulation may reduce some aspects of gum inflammation more than full‐mouth cleaning alone. The study did not report any of our other outcomes of interest listed above.

What are the limitations of the evidence?

The study did not examine the effects of treatment beyond 12 weeks; nor did it examine unwanted effects of treatment. For these reasons, we have little confidence in the evidence. We cannot make definitive clinical recommendations based on this one study.

How up to date is the evidence?

The evidence is current to January 2022."
CD012974.pub2,Neoadjuvant treatment for stage III and IV cutaneous melanoma,2023,January,17,2,https://doi.org/10.1002/14651858.CD012974.pub2,Skin,"Cancer, Skin disorders","Background
Cutaneous melanoma is amongst the most aggressive of all skin cancers. Neoadjuvant treatment is a form of induction therapy, given to shrink a cancerous tumour prior to the main treatment (usually surgery). The purpose is to improve survival and surgical outcomes. This review systematically appraises the literature investigating the use of neoadjuvant treatment for stage III and IV cutaneous melanoma.

Objectives
To assess the effects of neoadjuvant treatment in adults with stage III or stage IV melanoma according to the seventh edition American Joint Committee on Cancer (AJCC) staging system.

Search methods
We searched the following databases up to 10 August 2021 inclusive: Cochrane Skin Specialised Register, CENTRAL, MEDLINE, Embase, LILACS and four trials registers, together with reference checking and contact with study authors to identify additional studies. We also handsearched proceedings from specific conferences from 2016 to 2020 inclusive.

Selection criteria
Randomised controlled trials (RCTs) of people with stage III and IV melanoma, comparing neoadjuvant treatment strategies (using targeted treatments, immunotherapies, radiotherapy, topical treatments or chemotherapy) with any of these agents or current standard of care (SOC), were eligible for inclusion.

Data collection and analysis
We used standard Cochrane methods. Primary outcomes were overall survival (OS) and adverse effects (AEs). Secondary outcomes included time to recurrence (TTR), quality of life (QOL), and overall response rate (ORR). We used GRADE to evaluate the certainty of the evidence.

Main results
We included eight RCTs involving 402 participants. Studies enrolled adults, mostly with stage III melanoma, investigated immunotherapies, chemotherapy, or targeted treatments, and compared these with surgical excision with or without adjuvant treatment. Duration of follow‐up and therapeutic regimens varied, which, combined with heterogeneity in the population and definitions of the endpoints, precluded meta‐analysis of all identified studies. We performed a meta‐analysis including three studies.

We are very uncertain if neoadjuvant treatment increases OS when compared to no neoadjuvant treatment (hazard ratio (HR) 0.43, 95% confidence interval (CI) 0.15 to 1.21; 2 studies, 171 participants; very low‐certainty evidence). Neoadjuvant treatment may increase the rate of AEs, but the evidence is very uncertain (26% versus 16%, risk ratio (RR) 1.58, 95% CI 0.97 to 2.55; 2 studies, 162 participants; very low‐certainty evidence). We are very uncertain if neoadjuvant treatment increases TTR (HR 0.51, 95% CI 0.22 to 1.17; 2 studies, 171 participants; very low‐certainty evidence). Studies did not report ORR as a comparative outcome or measure QOL data.

We are very uncertain whether neoadjuvant targeted treatment with dabrafenib and trametinib increases OS (HR 0.28, 95% CI 0.03 to 2.25; 1 study, 21 participants; very low‐certainty evidence) or TTR (HR 0.02, 95% CI 0.00 to 0.22; 1 study, 21 participants; very low‐certainty evidence) when compared to surgery. The study did not report comparative rates of AEs and overall response, and did not measure QOL.

We are very uncertain if neoadjuvant immunotherapy with talimogene laherparepvec increases OS when compared to no neoadjuvant treatment (HR 0.49, 95% CI 0.15 to 1.64; 1 study, 150 participants, very low‐certainty evidence). It may have a higher rate of AEs, but the evidence is very uncertain (16.5% versus 5.8%, RR 2.84, 95% CI 0.96 to 8.37; 1 study, 142 participants; very low‐certainty evidence). We are very uncertain if it increases TTR (HR 0.75, 95% CI 0.31 to 1.79; 1 study, 150 participants; very low‐certainty evidence). The study did not report comparative ORRs or measure QOL.

OS was not reported for neoadjuvant immunotherapy (combined ipilimumab and nivolumab) when compared to the combination of ipilimumab and nivolumab as adjuvant treatment. There may be little or no difference in the rate of AEs between these treatments (9%, RR 1.0, 95% CI 0.75 to 1.34; 1 study, 20 participants; low‐certainty evidence). The study did not report comparative ORRs or measure TTR and QOL.

Neoadjuvant immunotherapy (combined ipilimumab and nivolumab) likely results in little to no difference in OS when compared to neoadjuvant nivolumab monotherapy (P = 0.18; 1 study, 23 participants; moderate‐certainty evidence). It may increase the rate of AEs, but the certainty of this evidence is very low (72.8% versus 8.3%, RR 8.73, 95% CI 1.29 to 59; 1 study, 23 participants); this trial was halted early due to observation of disease progression preventing surgical resection in the monotherapy arm and the high rate of treatment‐related AEs in the combination arm. Neoadjuvant combination treatment may lead to higher ORR, but the evidence is very uncertain (72.8% versus 25%, RR 2.91, 95% CI 1.02 to 8.27; 1 study, 23 participants; very low‐certainty evidence). It likely results in little to no difference in TTR (P = 0.19; 1 study, 23 participants; low‐certainty evidence). The study did not measure QOL.

OS was not reported for neoadjuvant immunotherapy (combined ipilimumab and nivolumab) when compared to neoadjuvant sequential immunotherapy (ipilimumab then nivolumab). Only Grade 3 to 4 immune‐related AEs were reported; fewer were reported with combination treatment, and the sequential treatment arm closed early due to a high incidence of severe AEs. The neoadjuvant combination likely results in a higher ORR compared to sequential neoadjuvant treatment (60.1% versus 42.3%, RR 1.42, 95% CI 0.87 to 2.32; 1 study, 86 participants; low‐certainty evidence). The study did not measure TTR and QOL.

No data were reported on OS, AEs, TTR, or QOL for the comparison of neoadjuvant interferon (HDI) plus chemotherapy versus neoadjuvant chemotherapy. Neoadjuvant HDI plus chemotherapy may have little to no effect on ORR, but the evidence is very uncertain (33% versus 22%, RR 1.75, 95% CI 0.62 to 4.95; 1 study, 36 participants; very low‐certainty evidence).

Authors' conclusions
We are uncertain if neoadjuvant treatment increases OS or TTR compared with no neoadjuvant treatment, and it may be associated with a slightly higher rate of AEs. There is insufficient evidence to support the use of neoadjuvant treatment in clinical practice. Priorities for research include the development of a core outcome set for neoadjuvant trials that are adequately powered, with validation of pathological and radiological responses as intermediate endpoints, to investigate the relative benefits of neoadjuvant treatment compared with adjuvan","What are the benefits and risks of neoadjuvant treatment (drug treatment prior to surgery to remove a tumour) for melanoma, a type of skin cancer?
What did we want to find out?

Cutaneous melanoma is a very aggressive form of skin cancer. It is generally fatal if detected at an advanced stage. Earlier treatment may allow for surgical removal of the tumour and an improved chance of long‐term survival. Neoadjuvant treatment is drug treatment administered before surgery, to reduce the tumour size so that it is easier to remove, to reduce complications of surgery, and to reduce the risk of spread of the disease. New drug types, immunotherapies and targeted treatments, have been developed which may be effective for neoadjuvant use.

We wanted to find out if neoadjuvant treatment of stage III or IV melanoma helps people live longer, and to compare adverse (unwanted) effects with neoadjuvant treatment and routine care.

What did we do?

We searched the medical literature for randomised controlled trials that compared certain types of treatments for melanoma skin cancer. The types of treatment included are:

‐ targeted treatments ‐ such as dabrafenib and trametinib;

‐ immunotherapies ‐ such as ipilimumab and nivolumab;

‐ chemotherapy ‐ such as dacarbazine and temozolomide;

‐ topical treatments ‐ such as imiquimod;

‐ radiotherapy.

We considered both single‐drug and combination‐drug treatments. We described and compared the results from these studies, taking into account the differences between the studies.

What did we find?

We identified eight randomised controlled trials that included 402 adults. The majority of people had stage III melanoma and were treated in hospital. Most studies used immunotherapies or targeted treatments, and compared these with surgery, with or without adjuvant treatment (treatment given after surgery to remove the tumour, to reduce the risk of the tumour coming back). No studies considered the impact of treatment on quality of life, and most studies did not compare tumour response rates after different treatments.

We are uncertain whether neoadjuvant treatment helps people live longer when compared with no neoadjuvant treatment. It may lead to more adverse events, and we are uncertain if it increases the time until the tumour comes back.

We are uncertain whether neoadjuvant targeted treatment with dabrafenib and trametinib helps people live longer, compared with no neoadjuvant treatment, or if it can increase the time until the tumour comes back. The study did not compare safety outcomes with each treatment.

We are uncertain if neoadjuvant immunotherapy with talimogene laherparepvec (T‐VEC) helps people live longer when compared with no neoadjuvant treatment. It may lead to more adverse events. We are uncertain if it increases the time until the tumour comes back.

No data were reported on whether neoadjuvant immunotherapy with combined ipilimumab and nivolumab helps people live longer, when compared with adjuvant (treatment given only after surgery) combined ipilimumab and nivolumab. There may be little or no difference in the rate of adverse events. No data were reported on whether neoadjuvant immunotherapy with combined ipilimumab and nivolumab increases the time until the tumour comes back.

Neoadjuvant combination of ipilimumab and nivolumab likely results in little or no difference in how long people live, when compared with neoadjuvant nivolumab. It may increase the rate of adverse events, but our confidence in the evidence is very low. It is worth noting that this trial was stopped early as patients in the neoadjuvant nivolumab arm may not be able to receive surgery due to disease progression and also because of a high rate of treatment‐related adverse events in the combination treatment arm. Combination treatment may lead to higher tumour response rates, but our confidence in the evidence is very low. The time until the tumour comes back may not be different.

No data were available on whether neoadjuvant immunotherapy with combined ipilimumab and nivolumab helps people live longer, when compared with neoadjuvant sequential treatment with ipilimumab and nivolumab. It likely results in fewer adverse events compared to sequential treatment, and may result in higher tumour response rates. The sequential treatment arm of the trial stopped recruiting patients due to a high incidence of severe AEs. Data on the time taken for the tumour to return were not collected.

No data were reported on whether neoadjuvant high‐dose interferon plus chemotherapy, when compared to neoadjuvant chemotherapy, can help people live longer, increase the time taken for the tumour to reoccur, reduce adverse events, or impact quality of life. It may have little to no effect on tumour response rates.

What does this mean?

We are uncertain if neoadjuvant treatment of stage III or IV melanoma will help people to live longer, or to have more time before the disease recurs. We are also uncertain if the benefits of neoadjuvant treatment outweigh the risks of adverse events.

How up to date is this evidence?

The evidence is up to date to August 2021."
